,race,subrace,section,content,race FR,subrace FR,section FR,content FR
0,owlin,owlin,Ability Scores,"One ability score of your choice increases by 2, and one other ability score of your choice increases by 1, or three ability scores of your choice increase by 1.",hibou,hibou,Scores de capacité,"Une valeur de capacité de votre choix augmente de 2, et une autre valeur de capacité de votre choix augmente de 1, ou trois valeurs de capacité de votre choix augmentent de 1."
1,owlin,owlin,Size,You are Medium or Small. You choose the size when you select this race.,hibou,hibou,Taille,Vous êtes de taille Medium ou Small. Vous choisissez la taille lorsque vous sélectionnez cette race.
2,owlin,owlin,Speed,"30 ft., fly 30 ft.",hibou,hibou,Vitesse,"30 pieds, volez 30 pieds."
3,owlin,owlin,Darkvision,You can see in dim light within 120 feet of yourself as if it were bright light and in darkness as if it were dim light. You discern colors in that darkness only as shades of gray.,hibou,hibou,Vision dans le noir,"Vous pouvez voir dans la pénombre à moins de 36 mètres de vous comme s'il s'agissait d'une lumière vive et dans l'obscurité comme s'il s'agissait d'une lumière tamisée. Dans cette obscurité, vous ne discernez les couleurs que sous forme de nuances de gris."
4,owlin,owlin,Flight,"Thanks to your wings, you have a flying speed equal to your walking speed. You can't use this flying speed if you're wearing medium or heavy armor.",hibou,hibou,Vol,"Grâce à vos ailes, vous avez une vitesse de vol égale à votre vitesse de marche. Vous ne pouvez pas utiliser cette vitesse de vol si vous portez une armure moyenne ou lourde."
5,owlin,owlin,Silent Feathers,You have proficiency in the Stealth skill.,hibou,hibou,Plumes silencieuses,Vous maîtrisez la compétence Furtivité.
6,owlin,owlin,Languages,"You can speak, read, and write Common and one other language that you and your DM agree is appropriate for your character.",hibou,hibou,Langues,"Vous pouvez parler, lire et écrire le commun et une autre langue que vous et votre MD considérez comme appropriée pour votre personnage."
