,subclass,ability,content,subclass_FR,contability_FR,content_FR,levels
0,arcane-archer,Arcane Archer Lore,"At 3rd level, you learn magical theory or some of the secrets of nature – typical for practitioners of of this elven martial tradition. You choose to gain proficiency in either the Arcana or the Nature skill, and you choose to learn either the Prestidigitation or Druidcraft cantrip.",archer arcanique,Connaissances des archers arcaniques,"Au niveau 3, vous apprenez la théorie magique ou certains secrets de la nature, typiques des pratiquants de cette tradition martiale elfique. Vous choisissez de maîtriser soit la compétence Arcanes, soit la compétence Nature, et vous choisissez d'apprendre soit le tour de passe-passe Prestidigitation, soit le tour de passe-passe Druidisme.",3.0
1,arcane-archer,Arcane Shot,"At 3rd level, you learn to unleash special magical effects with some of your shots. When you gain this feature, you learn two Arcane Shot options of your choice (see ""Arcane Shot Options"").Once per turn when you fire an arrow from a shortbow or longbow as part of the Attack action, you can apply one of your Arcane Shot options to that arrow. You decide to use the option when the arrow hits, unless the option doesn’t involve an attack roll. You have two uses of this ability, and you regain all expended uses of it when you finish a short or long rest.You gain an additional Arcane Shot option of your choice when you reach certain levels in this class: 7th, 10th, 15th, and 18th level. Each option also improves when you become an 18th-level fighter.",archer arcanique,Tir des arcanes,"Au niveau 3, vous apprenez à déclencher des effets magiques spéciaux avec certains de vos tirs. Lorsque vous obtenez cette capacité, vous apprenez deux options de Tir des arcanes de votre choix (voir « Options de Tir des arcanes »). Une fois par tour, lorsque vous tirez une flèche avec un arc court ou un arc long dans le cadre de l'action Attaquer, vous pouvez appliquer l'une de vos options de Tir des arcanes à cette flèche. Vous décidez d'utiliser l'option lorsque la flèche touche, à moins que l'option n'implique pas de jet d'attaque. Vous avez deux utilisations de cette capacité, et vous récupérez toutes les utilisations dépensées lorsque vous terminez un repos court ou long. Vous obtenez une option de Tir des arcanes supplémentaire de votre choix lorsque vous atteignez certains niveaux dans cette classe : 7e, 10e, 15e et 18e niveau. Chaque option s'améliore également lorsque vous devenez un combattant de niveau 18.",3.0
2,arcane-archer,Magic Arrow,"At 7th level, you gain the ability to infuse arrows with magic. Whenever you fire a nonmagical arrow from a shortbow or longbow, you can make it magical for the purpose of overcoming resistance and immunity to nonmagical attacks and damage. The magic fades from the arrow immediately after it hits or misses its target.",archer arcanique,Flèche magique,"Au niveau 7, vous obtenez la capacité d'imprégner les flèches de magie. Chaque fois que vous tirez une flèche non magique avec un arc court ou long, vous pouvez la rendre magique afin de surmonter la résistance et l'immunité aux attaques et dégâts non magiques. La magie de la flèche disparaît immédiatement après qu'elle a touché ou raté sa cible.",7.0
3,arcane-archer,Curving Shot,"At 7th level, you learn how to direct an errant arrow toward a new target. When you make an attack roll with a magic arrow and miss, you can use a bonus action to reroll the attack roll against a different target within 60 feet of the original target.",archer arcanique,Tir courbé,"Au niveau 7, vous apprenez à diriger une flèche errante vers une nouvelle cible. Lorsque vous effectuez un jet d'attaque avec une flèche magique et que vous ratez votre cible, vous pouvez utiliser une action bonus pour relancer le jet d'attaque contre une cible différente située à 18 mètres ou moins de la cible d'origine.",7.0
4,arcane-archer,Ever-Ready Shot,"Starting at 15th level, your magical archery is available whenever battle starts. If you roll initiative and have no uses of Arcane Shot remaining, you regain one use of it.Source: Xanathar's Guide to Everything",archer arcanique,Tir toujours prêt,"À partir du niveau 15, votre tir à l'arc magique est disponible dès le début de la bataille. Si vous obtenez l'initiative et qu'il ne vous reste plus aucune utilisation de Tir des arcanes, vous en récupérez une. Source : Xanathar's Guide to Everything",15.0
5,banneret,Restriction: Knighthood,Purple Dragon knights are tied to a specific order of Cormyrean knighthood.Banneret serves as the generic name for this archetype if you use it in other campaign settings or to model warlords other than Purple Dragon knights.,bannière,Restriction : Chevalerie,Les chevaliers du dragon violet sont liés à un ordre spécifique de chevalerie cormyréenne. Banneret sert de nom générique pour cet archétype si vous l'utilisez dans d'autres paramètres de campagne ou pour modéliser des seigneurs de guerre autres que les chevaliers du dragon violet.,
6,banneret,Rallying Cry,"When you choose this archetype at 3rd level, you learn how to inspire your allies to fight on past their injuries.When you use your Second Wind feature, you can choose up to three creatures within 60 feet of you that are allied with you. Each one regains hit points equal to your fighter level, provided that the creature can see or hear you.",bannière,Cri de ralliement,"Lorsque vous choisissez cet archétype au niveau 3, vous apprenez à motiver vos alliés à continuer à se battre malgré leurs blessures. Lorsque vous utilisez votre capacité Second souffle, vous pouvez choisir jusqu'à trois créatures dans un rayon de 18 mètres de vous qui sont alliées à vous. Chacune d'entre elles récupère un nombre de points de vie égal à votre niveau de combattant, à condition que la créature puisse vous voir ou vous entendre.",3.0
7,banneret,Royal Envoy,"Knights of high standing are expected to conduct themselves with grace.At 7th level, you gain proficiency in the Persuasion skill. If you are already proficient in it, you gain proficiency in one of the following skills of your choice: Animal Handling, Insight, Intimidation, or Performance.Your proficiency bonus is doubled for any ability check you make that uses Persuasion. You receive this benefit regardless of the skill proficiency you gain from this feature.",bannière,Envoyé royal,"Les chevaliers de haut rang doivent se conduire avec grâce.Au niveau 7, vous maîtrisez la compétence Persuasion. Si vous la maîtrisez déjà, vous maîtrisez l'une des compétences suivantes de votre choix : Dressage d'animaux, Perspicacité, Intimidation ou Représentation.Votre bonus de maîtrise est doublé pour tout test de caractéristique que vous effectuez qui utilise la persuasion. Vous recevez cet avantage quelle que soit la maîtrise de compétence que vous obtenez grâce à cette capacité.",7.0
8,banneret,Inspiring Surge,"Starting at 10th level, when you use your Action Surge feature, you can choose one creature within 60 feet of you that is allied with you. That creature can make one melee or ranged weapon attack with its reaction, provided that it can see or hear you.Starting at 18th level, you can choose two allies within 60 feet of you, rather than one.",bannière,Une poussée inspirante,"À partir du niveau 10, lorsque vous utilisez votre capacité Attaque, vous pouvez choisir une créature à 18 mètres ou moins de vous qui est alliée à vous. Cette créature peut effectuer une attaque d'arme de mêlée ou à distance avec sa réaction, à condition qu'elle puisse vous voir ou vous entendre. À partir du niveau 18, vous pouvez choisir deux alliés à 18 mètres ou moins de vous, au lieu d'un seul.",10.0
9,banneret,Bulwark,"Beginning at 15th level, you can extend the benefit of your Indomitable feature to an ally. When you decide to use Indomitable to reroll an Intelligence, a Wisdom, or a Charisma saving throw and you aren't incapacitated, you can choose one ally within 60 feet of you that also failed its saving throw against the same effect. If that creature can see or hear you, it can reroll its saving throw and must use the new roll.Source: Sword Coast Adventurer's Guide",bannière,Rempart,"À partir du niveau 15, vous pouvez étendre les avantages de votre capacité Indomptable à un allié. Lorsque vous décidez d'utiliser Indomptable pour relancer un jet de sauvegarde d'Intelligence, de Sagesse ou de Charisme et que vous n'êtes pas neutralisé, vous pouvez choisir un allié à 18 mètres ou moins de vous qui a également raté son jet de sauvegarde contre le même effet. Si cette créature peut vous voir ou vous entendre, elle peut relancer son jet de sauvegarde et doit utiliser le nouveau jet. Source : Sword Coast Adventurer's Guide",15.0
10,battle-master,Combat Superiority,"When you choose this archetype at 3rd level, you learn maneuvers that are fueled by special dice called superiority dice.Maneuvers
You learn three maneuvers of your choice. Many maneuvers enhance an attack in some way. You can use only one maneuver per attack. You learn two additional maneuvers of your choice at 7th, 10th, and 15th level. Each time you learn new maneuvers, you can also replace one maneuver you know with a different one.Superiority Dice
You have four superiority dice, which are d8s. A superiority die is expended when you use it. You regain all of your expended superiority dice when you finish a short or long rest. You gain another superiority die at 7th level and one more at 15th level.Saving Throws
Some of your maneuvers require your target to make a saving throw to resist the maneuver's effects. The saving throw DC is calculated as follows:Maneuver save DC = 8 + your proficiency bonus + your Strength or Dexterity modifier (your choice)",maître de bataille,Supériorité au combat,"Lorsque vous choisissez cet archétype au niveau 3, vous apprenez des manœuvres alimentées par des dés spéciaux appelés dés de supériorité. Manœuvres
Vous apprenez trois manœuvres de votre choix. De nombreuses manœuvres améliorent une attaque d'une manière ou d'une autre. Vous ne pouvez utiliser qu'une seule manœuvre par attaque. Vous apprenez deux manœuvres supplémentaires de votre choix aux niveaux 7, 10 et 15. Chaque fois que vous apprenez de nouvelles manœuvres, vous pouvez également remplacer une manœuvre que vous connaissez par une autre. Dés de supériorité
Vous disposez de quatre dés de supériorité, qui sont des d8. Un dé de supériorité est dépensé lorsque vous l'utilisez. Vous récupérez tous vos dés de supériorité dépensés lorsque vous terminez un repos court ou long. Vous gagnez un autre dé de supériorité au niveau 7 et un autre au niveau 15. Jets de sauvegarde
Certaines de vos manœuvres nécessitent que votre cible effectue un jet de sauvegarde pour résister aux effets de la manœuvre. Le DD du jet de sauvegarde est calculé comme suit : DD du jet de sauvegarde de manœuvre = 8 + votre bonus de maîtrise + votre modificateur de Force ou de Dextérité (à votre choix)",3.0
11,battle-master,Student of War,"At 3rd level, you gain proficiency with one type of artisan's tools of your choice.",maître de bataille,Étudiant en guerre,"Au niveau 3, vous acquérez la maîtrise d'un type d'outils d'artisan de votre choix.",3.0
12,battle-master,Know Your Enemy,"Starting at 7th level, if you spend at least 1 minute observing or interacting with another creature outside combat, you can learn certain information about its capabilities compared to your own. The DM tells you if the creature is your equal, superior, or inferior in regard to two of the following characteristics of your choice:
Strength score
Dexterity score
Constitution score
Armor Class
Current hit points
Total class levels, if any
Fighter class levels, if any
",maître de bataille,Connaissez votre ennemi,"À partir du niveau 7, si vous passez au moins 1 minute à observer ou à interagir avec une autre créature en dehors du combat, vous pouvez apprendre certaines informations sur ses capacités par rapport aux vôtres. Le MD vous indique si la créature est votre égale, supérieure ou inférieure en ce qui concerne deux des caractéristiques suivantes de votre choix :
Score de force
Score de dextérité
Score de constitution
Classe d'armure
Points de vie actuels
Niveaux de classe totaux, le cas échéant
Niveaux de classe de combattant, le cas échéant",7.0
13,battle-master,Improved Combat Superiority,"At 10th level, your superiority dice turn into d10s. At 18th level, they turn into d12s.",maître de bataille,Amélioration de la supériorité au combat,"Au niveau 10, vos dés de supériorité se transforment en d10. Au niveau 18, ils se transforment en d12.",10.0
14,battle-master,Relentless,"Starting at 15th level, when you roll initiative and have no superiority dice remaining, you regain 1 superiority die.Source: Player's Handbook",maître de bataille,Sans relâche,"À partir du niveau 15, lorsque vous lancez l'initiative et qu'il ne vous reste plus de dés de supériorité, vous récupérez 1 dé de supériorité.Source : Manuel du joueur",15.0
15,cavalier,Bonus Proficiency,"When you choose this archetype at 3rd level, you gain proficiency in one of the following skills of your choice: Animal Handling, History, Insight, Performance, or Persuasion. Alternatively, you learn one language of your choice.",cavalier,Bonus de compétence,"Lorsque vous choisissez cet archétype au niveau 3, vous obtenez la maîtrise de l'une des compétences suivantes de votre choix : Dressage d'animaux, Histoire, Perspicacité, Représentation ou Persuasion. Vous pouvez également apprendre une langue de votre choix.",3.0
16,cavalier,Born to the Saddle,"Starting at 3rd level, your mastery as a rider becomes apparent. You have advantage on saving throws made to avoid falling off your mount. If you fall off your mount and descend no more than 10 feet, you can land on your feet if you’re not incapacitated.Finally, mounting or dismounting a creature costs you only 5 feet of movement, rather than half your speed.",cavalier,Né pour la selle,"À partir du niveau 3, votre maîtrise du cavalier devient évidente. Vous bénéficiez d'un avantage sur les jets de sauvegarde effectués pour éviter de tomber de votre monture. Si vous tombez de votre monture et descendez de moins de 3 mètres, vous pouvez retomber sur vos pieds si vous n'êtes pas immobilisé. Enfin, monter ou descendre d'une créature ne vous coûte que 1,5 mètre de déplacement, au lieu de la moitié de votre vitesse.",3.0
17,cavalier,Unwavering Mark,"Starting at 3rd level, you can menace your foes, foiling their attacks and punishing them for harming others. When you hit a creature with a melee weapon attack, you can mark the creature until the end of your next turn. This effect ends early if you are incapacitated or you die, or if someone else marks the creature.While it is within 5 feet of you, a creature marked by you has disadvantage on any attack roll that doesn't target you.In addition, if a creature marked by you deals damage to anyone other than you, you can make a special melee weapon attack against the marked creature as a bonus action on your next turn. You have advantage on the attack roll, and if it hits, the attack's weapon deals extra damage to the target equal to half your fighter level.Regardless of the number of creatures you mark, you can make this special attack a number of times equal to your Strength modifier (a minimum of once), and you regain all expended uses of it when you finish a long rest.",cavalier,Marque inébranlable,"À partir du niveau 3, vous pouvez menacer vos ennemis, déjouer leurs attaques et les punir pour avoir blessé d'autres personnes. Lorsque vous touchez une créature avec une attaque d'arme de mêlée, vous pouvez la marquer jusqu'à la fin de votre prochain tour. Cet effet se termine prématurément si vous êtes neutralisé ou si vous mourez, ou si quelqu'un d'autre marque la créature. Tant qu'elle se trouve à 1,50 mètre ou moins de vous, une créature que vous avez marquée a un désavantage sur tout jet d'attaque qui ne vous cible pas. De plus, si une créature que vous avez marquée inflige des blessures à quelqu'un d'autre que vous, vous pouvez effectuer une attaque d'arme de mêlée spéciale contre la créature marquée en tant qu'action bonus lors de votre prochain tour. Vous avez l'avantage sur le jet d'attaque, et si elle touche, l'arme de l'attaque inflige des dégâts supplémentaires à la cible égaux à la moitié de votre niveau de combattant. Quel que soit le nombre de créatures que vous marquez, vous pouvez effectuer cette attaque spéciale un nombre de fois égal à votre modificateur de Force (au moins une fois), et vous récupérez toutes les utilisations dépensées de celle-ci lorsque vous terminez un repos long.",3.0
18,cavalier,Warding Maneuver,"At 7th level, you learn to fend off strikes directed at you, your mount, or other creatures nearby. If you or a creature you can see within 5 feet of you is hit by an attack, you can roll 1d8 as a reaction if you're wielding a melee weapon or a shield. Roll the die, and add the number rolled to the target's AC against that attack. If the attack still hits, the target has resistance against the attack's damage.You can use this feature a number of times equal to your Constitution modifier (a minimum of once), and you regain all expended uses of it when you finish a long rest.",cavalier,Manœuvre de protection,"Au niveau 7, vous apprenez à parer les attaques dirigées contre vous, votre monture ou d'autres créatures proches. Si vous ou une créature que vous pouvez voir à 1,50 mètre de vous êtes touché par une attaque, vous pouvez lancer 1d8 en réaction si vous portez une arme de mêlée ou un bouclier. Lancez le dé et ajoutez le résultat obtenu à la CA de la cible contre cette attaque. Si l'attaque réussit quand même, la cible a une résistance contre les dégâts de l'attaque. Vous pouvez utiliser cette capacité un nombre de fois égal à votre modificateur de Constitution (au moins une fois), et vous récupérez toutes les utilisations dépensées lorsque vous terminez un repos long.",7.0
19,cavalier,Hold the Line,"At 10th level, you become a master of locking down your enemies. Creatures provoke an opportunity attack from you when they move 5 feet or more while within your reach, and if you hit a creature with an opportunity attack, the target's speed is reduced to 0 until the end of the current turn.",cavalier,Maintenez la ligne,"Au niveau 10, vous devenez un maître dans l'art de bloquer vos ennemis. Les créatures provoquent une attaque d'opportunité de votre part lorsqu'elles se déplacent de 1,50 mètre ou plus alors qu'elles sont à votre portée, et si vous touchez une créature avec une attaque d'opportunité, la vitesse de la cible est réduite à 0 jusqu'à la fin du tour en cours.",10.0
20,cavalier,Ferocious Charger,"Starting at 15th level, you can run down your foes, whether you're mounted or not. If you move at least 10 feet in a straight line right before attacking a creature and you hit it with the attack, that target must succeed on a Strength saving throw (DC 8 + your proficiency bonus + your Strength modifier) or be knocked prone. You can use this feature only once on each of your turns.",cavalier,Chargeur féroce,"À partir du niveau 15, vous pouvez courir après vos ennemis, que vous soyez monté ou non. Si vous vous déplacez d'au moins 3 mètres en ligne droite juste avant d'attaquer une créature et que vous la touchez avec l'attaque, cette cible doit réussir un jet de sauvegarde de Force (DD 8 + votre bonus de maîtrise + votre modificateur de Force) ou être mise à terre. Vous ne pouvez utiliser cette capacité qu'une seule fois à chacun de vos tours.",15.0
21,cavalier,Vigilant Defender,"Starting at 18th level, you respond to danger with extraordinary vigilance. In combat, you get a special reaction that you can take once on every creature's turn, except your turn. You can use this special reaction only to make an opportunity attack, and you can't use it on the same turn that you take your normal reaction.Source: Xanathar's Guide to Everything",cavalier,Défenseur vigilant,"À partir du niveau 18, vous réagissez au danger avec une vigilance extraordinaire. En combat, vous obtenez une réaction spéciale que vous pouvez utiliser une fois à chaque tour de créature, sauf le vôtre. Vous ne pouvez utiliser cette réaction spéciale que pour effectuer une attaque d'opportunité, et vous ne pouvez pas l'utiliser au même tour que celui où vous utilisez votre réaction normale. Source : Xanathar's Guide to Everything",18.0
22,champion,Improved Critical,"Beginning when you choose this archetype at 3rd level, your weapon attacks score a critical hit on a roll of 19 or 20.",champion,Critique améliorée,"À partir du moment où vous choisissez cet archétype au niveau 3, vos attaques d'armes infligent un coup critique sur un résultat de 19 ou 20.",3.0
23,champion,Remarkable Athlete,"Starting at 7th level, you can add half your proficiency bonus (rounded up) to any Strength, Dexterity, or Constitution check you make that doesn't already use your proficiency bonus.In addition, when you make a running long jump, the distance you can cover increases by a number of feet equal to your Strength modifier.",champion,Athlète remarquable,"À partir du niveau 7, vous pouvez ajouter la moitié de votre bonus de maîtrise (arrondi au supérieur) à tout test de Force, de Dextérité ou de Constitution que vous effectuez et qui n'utilise pas déjà votre bonus de maîtrise. De plus, lorsque vous effectuez un saut en longueur avec élan, la distance que vous pouvez parcourir augmente d'un nombre de pieds égal à votre modificateur de Force.",7.0
24,champion,Additional Fighting Style,"At 10th level, you can choose a second option from the Fighting Style class feature.",champion,Style de combat supplémentaire,"Au niveau 10, vous pouvez choisir une deuxième option parmi la fonctionnalité de classe Style de combat.",10.0
25,champion,Superior Critical,"Starting at 15th level, your weapon attacks score a critical hit on a roll of 18-20.",champion,Supérieur critique,"À partir du niveau 15, vos attaques d'armes infligent un coup critique sur un résultat de 18 à 20.",15.0
26,champion,Survivor,"At 18th level, you attain the pinnacle of resilience in battle. At the start of each of your turns, you regain hit points equal to 5 + your Constitution modifier if you have no more than half of your hit points left. You don't gain this benefit if you have 0 hit points.Source: Player's Handbook",champion,Survivant,"Au niveau 18, vous atteignez le summum de la résilience au combat. Au début de chacun de vos tours, vous récupérez un nombre de points de vie égal à 5 ​​+ votre modificateur de Constitution s'il ne vous reste plus que la moitié de vos points de vie. Vous ne bénéficiez pas de cet avantage si vous avez 0 point de vie. Source : Manuel du joueur",18.0
