,subclass,ability,content,subclass_FR,contability_FR,content_FR,levels
27,echo-knight,Manifest Echo,"3rd-level Echo Knight feature
You can use a bonus action to magically manifest an echo of yourself in an unoccupied space you can see within 15 feet of you. This echo is a magical, translucent, gray image of you that lasts until it is destroyed, until you dismiss it as a bonus action, until you manifest another echo, or until you're incapacitated.Your echo has AC 14 + your proficiency bonus, 1 hit point, and immunity to all conditions. If it has to make a saving throw, it uses your saving throw bonus for the roll. It is the same size as you, and it occupies its space. On your turn, you can mentally command the echo to move up to 30 feet in any direction (no action required). If your echo is ever more than 30 feet from you at the end of your turn, it is destroyed. You can use the echo in the following ways:
As a bonus action, you can teleport, magically swapping places with your echo at a cost of 15 feet of your movement, regardless of the distance between the two of you.
When you take the Attack action on your turn, any attack you make with that action can originate from your space or the echo's space. You make this choice for each attack.
When a creature that you can see within 5 feet of your echo moves at least 5 feet away from it, you can use your reaction to make an opportunity attack against that creature as if you were in the echo's space.
",chevalier-écho,Écho manifeste,"Vous pouvez utiliser une action bonus pour faire apparaître par magie un écho de vous-même dans un espace inoccupé que vous pouvez voir à moins de 4,5 mètres de vous. Cet écho est une image magique, translucide et grise de vous qui dure jusqu'à ce qu'il soit détruit, jusqu'à ce que vous le rejetiez par une action bonus, jusqu'à ce que vous manifestiez un autre écho ou jusqu'à ce que vous soyez neutralisé. Votre écho a une CA de 14 + votre bonus de maîtrise, 1 point de vie et une immunité à toutes les conditions. S'il doit faire un jet de sauvegarde, il utilise votre bonus de jet de sauvegarde pour le lancer. Il a la même taille que vous et il occupe son espace. À votre tour, vous pouvez commander mentalement à l'écho de se déplacer jusqu'à 9 mètres dans n'importe quelle direction (aucune action requise). Si votre écho se trouve à plus de 9 mètres de vous à la fin de votre tour, il est détruit. Vous pouvez utiliser l'écho de la manière suivante :
En tant qu'action bonus, vous pouvez vous téléporter et échanger magiquement votre place avec votre écho pour un coût de 4,5 mètres de votre mouvement, quelle que soit la distance qui vous sépare.
Lorsque vous effectuez l'action Attaquer à votre tour, toute attaque que vous effectuez avec cette action peut provenir de votre case ou de la case de l'écho. Vous faites ce choix pour chaque attaque.
Lorsqu'une créature que vous pouvez voir à moins de 1,5 mètre de votre écho s'éloigne d'au moins 1,5 mètre de lui, vous pouvez utiliser votre réaction pour effectuer une attaque d'opportunité contre cette créature comme si vous étiez dans la case de l'écho.",3.0
28,echo-knight,Unleash Incarnation,"3rd-level Echo Knight feature
You can heighten your echo's fury. Whenever you take the Attack action, you can make one additional melee attack from the echo's position.You can use this feature a number of times equal to your Constitution modifier (a minimum of once). You regain all expended uses when you finish a long rest.",chevalier-écho,Libérer l'Incarnation,"Fonctionnalité de Chevalier écho de niveau 3
Vous pouvez augmenter la fureur de votre écho. Chaque fois que vous effectuez l'action Attaquer, vous pouvez effectuer une attaque de mêlée supplémentaire depuis la position de l'écho. Vous pouvez utiliser cette fonctionnalité un nombre de fois égal à votre modificateur de Constitution (au moins une fois). Vous récupérez toutes les utilisations dépensées lorsque vous terminez un repos long.",3.0
29,echo-knight,Echo Avatar,"7th-level Echo Knight feature
You can temporarily transfer your consciousness to your echo. As an action, you can see through your echo's eyes and hear through its ears. During this time, you are deafened and blinded. You can sustain this effect for up to 10 minutes, and you can end it at any time (requires no action). While your echo is being used in this way, it can be up to 1 ,000 feet away from you without being destroyed.",chevalier-écho,Avatar d'écho,"Fonctionnalité Chevalier de l'écho de niveau 7
Vous pouvez transférer temporairement votre conscience à votre écho. En tant qu'action, vous pouvez voir à travers les yeux de votre écho et entendre à travers ses oreilles. Pendant ce temps, vous êtes assourdi et aveuglé. Vous pouvez maintenir cet effet jusqu'à 10 minutes et vous pouvez y mettre fin à tout moment (aucune action n'est requise). Tant que votre écho est utilisé de cette manière, il peut se trouver à 1 000 pieds de vous sans être détruit.",7.0
30,echo-knight,Shadow Martyr,"10th-level Echo Knight feature
You can make your echo throw itself in front of an attack directed at another creature that you can see. Before the attack roll is made, you can use your reaction to teleport the echo to an unoccupied space within 5 feet of the targeted creature. The attack roll that triggered the reaction is instead made against your echo.Once you use this feature, you can't use it again until you finish a short or long rest.",chevalier-écho,Martyr de l'ombre,"Fonctionnalité du Chevalier écho de niveau 10
Vous pouvez faire en sorte que votre écho se projette devant une attaque dirigée contre une autre créature que vous pouvez voir. Avant que le jet d'attaque ne soit effectué, vous pouvez utiliser votre réaction pour téléporter l'écho dans un espace inoccupé à 1,50 mètre de la créature ciblée. Le jet d'attaque qui a déclenché la réaction est alors effectué contre votre écho. Une fois que vous avez utilisé cette fonctionnalité, vous ne pouvez plus l'utiliser avant d'avoir terminé un repos court ou long.",10.0
31,echo-knight,Reclaim Potential,"15th-level Echo Knight feature
You've learned to absorb the fleeting magic of your echo. When an echo of yours is destroyed by taking damage, you can gain a number of temporary hit points equal to 2d6 + your Constitution modifier, provided you don't already have temporary hit points.You can use this feature a number of times equal to your Constitution modifier (a minimum of once). You regain all expended uses when you finish a long rest.",chevalier-écho,Récupérer le potentiel,"15e niveau - Capacité du Chevalier de l'écho
Vous avez appris à absorber la magie éphémère de votre écho. Lorsqu'un de vos échos est détruit en subissant des dégâts, vous pouvez gagner un nombre de points de vie temporaires égal à 2d6 + votre modificateur de Constitution, à condition que vous n'ayez pas déjà de points de vie temporaires. Vous pouvez utiliser cette capacité un nombre de fois égal à votre modificateur de Constitution (au moins une fois). Vous récupérez toutes les utilisations dépensées lorsque vous terminez un repos long.",15.0
32,echo-knight,Legion Of One,"18th-level Echo Knight feature
You can use a bonus action to create two echoes with your Manifest Echo feature, and these echoes can coexist. If you try to create a third echo, the previous two echoes are destroyed. Anything you can do from one echo's position can be done from the other's instead.In addition, when you roll initiative and have no uses of your Unleash Incarnation feature left, you regain one use of that feature.Source: Explorer's Guide to Wildemount",chevalier-écho,Légion de l'Unique,"Fonctionnalité Chevalier de l'écho de niveau 18
Vous pouvez utiliser une action bonus pour créer deux échos avec votre fonctionnalité Manifester l'écho, et ces échos peuvent coexister. Si vous essayez de créer un troisième écho, les deux échos précédents sont détruits. Tout ce que vous pouvez faire depuis la position d'un écho peut être fait depuis celle de l'autre. De plus, lorsque vous lancez l'initiative et que vous n'avez plus aucune utilisation de votre fonctionnalité Libérer l'incarnation, vous récupérez une utilisation de cette fonctionnalité.Source : Guide de l'explorateur de Wildemount",18.0
33,eldritch.knight,Spellcasting,"When you reach 3rd level, you augment your martial prowess with the ability to cast spells.CantripsYou learn two cantrips of your choice from the wizard spell list. You learn an additional wizard cantrip of your choice at 10th level.Spell SlotsThe Eldritch Knight Spellcasting table shows how many spell slots you have to cast your spells of 1st level and higher. To cast one of these spells, you must expend a slot of the spell's level or higher. You regain all expended spell slots when you finish a long rest.For example, if you know the 1st-level spell Shield and have a 1st-level and a 2nd-level spell slot available, you can cast Shield using either slot.Spells Known of 1st Level and HigherYou know three 1st-level wizard spells of your choice, two of which you must choose from the abjuration and evocation spells on the wizard spell list.The Spells Known column of the Eldritch Knight Spellcasting table shows when you learn more wizard spells of 1st level or higher. Each of these spells must be an abjuration or evocation spell of your choice, and must be of a level for which you have spell slots. For instance, when you reach 7th level in this class, you can learn one new spell of 1st or 2nd level.The spells you learn at 8th, 14th, and 20th level can come from any school of magic.Whenever you gain a level in this class, you can replace one of the wizard spells you know with another spell of your choice from the wizard spell list. The new spell must be of a level for which you have spell slots, and it must be an abjuration or evocation spell, unless you're replacing the spell you gained at 3rd, 8th, 14th, or 20th level from any school of magic.Spellcasting AbilityIntelligence is your spellcasting ability for your wizard spells, since you learn your spells through study and memorization. You use your Intelligence whenever a spell refers to your spellcasting ability. In addition, you use your Intelligence modifier when setting the saving throw DC for a wizard spell you cast and when making an attack roll with one.Spell save DC = 8 + your proficiency bonus + your Intelligence modifierSpell attack modifier = your proficiency bonus + your Intelligence modifier",chevalier surnaturel,Lancer des sorts,"Lorsque vous atteignez le niveau 3, vous augmentez vos prouesses martiales avec la capacité de lancer des sorts. Tours de magieVous apprenez deux tours de magie de votre choix dans la liste des sorts de magicien. Vous apprenez un tour de magie supplémentaire de votre choix au niveau 10. Emplacements de sortsLe tableau de lancement de sorts du Chevalier Eldritch indique le nombre d'emplacements de sorts dont vous disposez pour lancer vos sorts de niveau 1 et supérieurs. Pour lancer l'un de ces sorts, vous devez dépenser un emplacement du niveau du sort ou supérieur. Vous récupérez tous les emplacements de sorts dépensés lorsque vous terminez un repos long. Par exemple, si vous connaissez le sort de niveau 1 Bouclier et que vous avez un emplacement de sort de niveau 1 et un emplacement de sort de niveau 2 disponibles, vous pouvez lancer Bouclier en utilisant l'un ou l'autre emplacement. Sorts connus de niveau 1 et supérieur Vous connaissez trois sorts de magicien de niveau 1 de votre choix, dont deux que vous devez choisir parmi les sorts d'abjuration et d'évocation de la liste des sorts de magicien. La colonne Sorts connus du tableau de lancement de sorts du Chevalier occulte indique quand vous apprenez davantage de sorts de magicien de niveau 1 ou supérieur. Chacun de ces sorts doit être un sort d'abjuration ou d'évocation de votre choix, et doit être d'un niveau pour lequel vous avez des emplacements de sort. Par exemple, lorsque vous atteignez le niveau 7 dans cette classe, vous pouvez apprendre un nouveau sort de niveau 1 ou 2. Les sorts que vous apprenez aux niveaux 8, 14 et 20 peuvent provenir de n'importe quelle école de magie. Chaque fois que vous gagnez un niveau dans cette classe, vous pouvez remplacer l'un des sorts de sorcier que vous connaissez par un autre sort de votre choix dans la liste des sorts de sorcier. Le nouveau sort doit être d'un niveau pour lequel vous avez des emplacements de sort, et il doit s'agir d'un sort d'abjuration ou d'évocation, à moins que vous ne remplaciez le sort que vous avez obtenu aux niveaux 3, 8, 14 ou 20 dans n'importe quelle école de magie. Capacité de lancer de sorts L'intelligence est votre capacité de lancer de sorts pour vos sorts de sorcier, car vous apprenez vos sorts par l'étude et la mémorisation. Vous utilisez votre Intelligence chaque fois qu'un sort fait référence à votre capacité de lancer de sorts. De plus, vous utilisez votre modificateur d'Intelligence lorsque vous définissez le DD du jet de sauvegarde d'un sort de sorcier que vous lancez et lorsque vous effectuez un jet d'attaque avec un sort.DD de sauvegarde de sort = 8 + votre bonus de maîtrise + votre modificateur d'IntelligenceModificateur d'attaque de sort = votre bonus de maîtrise + votre modificateur d'Intelligence",3.0
34,eldritch.knight,Weapon Bond,"At 3rd level, you learn a ritual that creates a magical bond between yourself and one weapon. You perform the ritual over the course of 1 hour, which can be done during a short rest. The weapon must be within your reach throughout the ritual, at the conclusion of which you touch the weapon and forge the bond.Once you have bonded a weapon to yourself, you can't be disarmed of that weapon unless you are incapacitated. If it is on the same plane of existence, you can summon that weapon as a bonus action on your turn, causing it to teleport instantly to your hand.You can have up to two bonded weapons, but can summon only one at a time with your bonus action. If you attempt to bond with a third weapon, you must break the bond with one of the other two.",chevalier surnaturel,Lien d'arme,"Au niveau 3, vous apprenez un rituel qui crée un lien magique entre vous et une arme. Vous effectuez le rituel en 1 heure, ce qui peut être fait pendant un court repos. L'arme doit être à votre portée pendant tout le rituel, à la fin duquel vous touchez l'arme et forgez le lien. Une fois que vous avez lié une arme à vous-même, vous ne pouvez pas vous en séparer à moins d'être neutralisé. Si elle se trouve sur le même plan d'existence, vous pouvez invoquer cette arme par une action bonus à votre tour, ce qui la téléportera instantanément dans votre main. Vous pouvez avoir jusqu'à deux armes liées, mais vous ne pouvez en invoquer qu'une à la fois avec votre action bonus. Si vous tentez de vous lier à une troisième arme, vous devez rompre le lien avec l'une des deux autres.",3.0
35,eldritch.knight,War Magic,"Beginning at 7th level, when you use your action to cast a cantrip, you can make one weapon attack as a bonus action.",chevalier surnaturel,Magie de guerre,"À partir du niveau 7, lorsque vous utilisez votre action pour lancer un tour de passe-passe, vous pouvez effectuer une attaque d'arme en tant qu'action bonus.",7.0
36,eldritch.knight,Eldritch Strike,"At 10th level, you learn how to make your weapon strikes undercut a creature's resistance to your spells. When you hit a creature with a weapon attack, that creature has disadvantage on the next saving throw it makes against a spell you cast before the end of your next turn.",chevalier surnaturel,Frappe surnaturelle,"Au niveau 10, vous apprenez à faire en sorte que vos attaques d'armes réduisent la résistance d'une créature à vos sorts. Lorsque vous frappez une créature avec une attaque d'arme, cette créature subit un désavantage au prochain jet de sauvegarde qu'elle effectue contre un sort que vous lancez avant la fin de votre prochain tour.",10.0
37,eldritch.knight,Arcane Charge,"At 15th level, you gain the ability to teleport up to 30 feet to an unoccupied space you can see when you use your Action Surge. You can teleport before or after the additional action.",chevalier surnaturel,Charge arcanique,"Au niveau 15, vous obtenez la capacité de vous téléporter jusqu'à 9 mètres dans un espace inoccupé que vous pouvez voir lorsque vous utilisez votre Surtension d'action. Vous pouvez vous téléporter avant ou après l'action supplémentaire.",15.0
38,eldritch.knight,Improved War Magic,"Starting at 18th level, when you use your action to cast a spell, you can make one weapon attack as a bonus action.Source: Player's Handbook",chevalier surnaturel,Magie de guerre améliorée,"À partir du niveau 18, lorsque vous utilisez votre action pour lancer un sort, vous pouvez effectuer une attaque d'arme en tant qu'action bonus.Source : Manuel du joueur",18.0
39,psi-warrior,Psionic Power,"3rd-level Psi Warrior feature
You harbor a wellspring of psionic energy within yourself. This energy is represented by your Psionic Energy dice, which are each a d6. You have a number of these dice equal to twice your proficiency bonus, and they fuel various psionic powers you have, which are detailed below.Some of your powers expend the Psionic Energy die they use, as specified in a power's description, and you can't use a power if it requires you to use a die when your dice are all expended. You regain all your expended Psionic Energy dice when you finish a long rest. In addition, as a bonus action, you can regain one expended Psionic Energy die, but you can't do so again until you finish a short or long rest.When you reach certain levels in this class, the size of your Psionic Energy dice increases: at 5th level (d8), 11th level (d10), and 17th level (d12).The powers below use your Psionic Energy dice.Protective Field. When you or another creature you can see within 30 feet of you takes damage, you can use your reaction to expend one Psionic Energy die, roll the die, and reduce the damage taken by the number rolled plus your Intelligence modifier (minimum reduction of 1), as you create a momentary shield of telekinetic force.Psionic Strike. You can propel your weapons with psionic force. Once on each of your turns, immediately after you hit a target within 30 feet of you with an attack and deal damage to it with a weapon, you can expend one Psionic Energy die, rolling it and dealing force damage to the target equal to the number rolled plus your Intelligence modifier.Telekinetic Movement. You can move an object or a creature with your mind. As an action, you target one loose object that is Large or smaller or one willing creature, other than yourself. If you can see the target and it is within 30 feet of you, you can move it up to 30 feet to an unoccupied space you can see. Alternatively, if it is a Tiny object, you can move it to or from your hand. Either way, you can move the target horizontally, vertically, or both.Once you take this action, you can't do so again until you finish a short or long rest, unless you expend a Psionic Energy die to take it again.",guerrier psi,Pouvoir psionique,"Vous possédez une source d'énergie psionique en vous. Cette énergie est représentée par vos dés d'énergie psionique, qui sont chacun un d6. Vous possédez un nombre de ces dés égal à deux fois votre bonus de maîtrise, et ils alimentent divers pouvoirs psioniques dont vous disposez, qui sont détaillés ci-dessous. Certains de vos pouvoirs dépensent le dé d'énergie psionique qu'ils utilisent, comme spécifié dans la description d'un pouvoir, et vous ne pouvez pas utiliser un pouvoir s'il nécessite que vous utilisiez un dé lorsque vos dés sont tous dépensés. Vous récupérez tous vos dés d'énergie psionique dépensés lorsque vous terminez un repos long. De plus, en tant qu'action bonus, vous pouvez récupérer un dé d'énergie psionique dépensé, mais vous ne pouvez pas le faire à nouveau avant d'avoir terminé un repos court ou long.Lorsque vous atteignez certains niveaux dans cette classe, la taille de vos dés d'énergie psionique augmente : au niveau 5 (d8), au niveau 11 (d10) et au niveau 17 (d12).Les pouvoirs ci-dessous utilisent vos dés d'énergie psionique.Champ de protection. Lorsque vous ou une autre créature que vous pouvez voir à moins de 9 mètres de vous subissez des dégâts, vous pouvez utiliser votre réaction pour dépenser un dé d'énergie psionique, lancer le dé et réduire les dégâts subis du nombre obtenu plus votre modificateur d'intelligence (réduction minimale de 1), tout en créant un bouclier momentané de force télékinétique.Frappe psionique. Vous pouvez propulser vos armes avec la force psionique. Une fois à chacun de vos tours, immédiatement après avoir touché une cible à 9 mètres ou moins de vous avec une attaque et lui avoir infligé des dégâts avec une arme, vous pouvez dépenser un dé d'énergie psionique, le lancer et infliger à la cible des dégâts de force égaux au nombre obtenu plus votre modificateur d'intelligence. Mouvement télékinétique. Vous pouvez déplacer un objet ou une créature avec votre esprit. En tant qu'action, vous ciblez un objet libre de taille G ou plus petit ou une créature consentante, autre que vous-même. Si vous pouvez voir la cible et qu'elle est à 9 mètres ou moins de vous, vous pouvez la déplacer jusqu'à 9 mètres vers un espace inoccupé que vous pouvez voir. Alternativement, s'il s'agit d'un objet de taille minuscule, vous pouvez le déplacer vers ou depuis votre main. Dans les deux cas, vous pouvez déplacer la cible horizontalement, verticalement ou les deux. Une fois que vous avez effectué cette action, vous ne pouvez plus le faire avant d'avoir terminé un repos court ou long, à moins que vous ne dépensiez un dé d'énergie psionique pour l'effectuer à nouveau.",3.0
40,psi-warrior,Telekinetic Adept,"7th-level Psi Warrior feature
You have mastered new ways to use your telekinetic abilities, detailed below.Psi-Powered Leap. As a bonus action, you can propel your body with your mind. You gain a flying speed equal to twice your walking speed until the end of the current turn. Once you take this bonus action, you can't do so again until you finish a short or long rest, unless you expend a Psionic Energy die to take it again.Telekinetic Thrust. When you deal damage to a target with your Psionic Strike, you can force the target to make a Strength saving throw against a DC equal to 8 + your proficiency bonus + your Intelligence modifier. If the save fails, you can knock the target prone or move it up to 10 feet in any direction horizontally.",guerrier psi,Adepte de la télékinésie,"7e niveau Guerrier Psi
Vous maîtrisez de nouvelles façons d'utiliser vos capacités télékinétiques, détaillées ci-dessous.Saut psionique. En tant qu'action bonus, vous pouvez propulser votre corps avec votre esprit. Vous gagnez une vitesse de vol égale à deux fois votre vitesse de marche jusqu'à la fin du tour en cours. Une fois que vous avez effectué cette action bonus, vous ne pouvez plus le faire avant d'avoir terminé un repos court ou long, à moins que vous ne dépensiez un dé d'énergie psionique pour l'effectuer à nouveau.Poignée télékinétique. Lorsque vous infligez des dégâts à une cible avec votre Frappe psionique, vous pouvez forcer la cible à effectuer un jet de sauvegarde de Force contre un DD égal à 8 + votre bonus de maîtrise + votre modificateur d'Intelligence. Si le jet de sauvegarde échoue, vous pouvez mettre la cible à terre ou la déplacer horizontalement jusqu'à 3 mètres dans n'importe quelle direction.",7.0
41,psi-warrior,Guarded Mind,"10th-level Psi Warrior feature
The psionic energy flowing through you has bolstered your mind. You have resistance to psychic damage. Moreover, if you start your turn charmed or frightened, you can expend a Psionic Energy die and end every effect on yourself subjecting you to those conditions.",guerrier psi,Esprit gardé,"Capacité Guerrier Psi de niveau 10
L'énergie psionique qui vous traverse a renforcé votre esprit. Vous avez une résistance aux dégâts psychiques. De plus, si vous commencez votre tour charmé ou effrayé, vous pouvez dépenser un dé d'énergie psionique et mettre fin à tous les effets vous soumettant à ces conditions.",10.0
42,psi-warrior,Bulwark of Force,"15th-level Psi Warrior feature
You can shield yourself and others with telekinetic force. As a bonus action, you can choose creatures, which can include you, that you can see within 30 feet of you, up to a number of creatures equal to your Intelligence modifier (minimum of one creature). Each of the chosen creatures is protected by half cover for 1 minute or until you're incapacitated.Once you take this bonus action, you can't do so again until you finish a long rest, unless you expend a Psionic Energy die to take it again.",guerrier psi,Rempart de la force,"15e niveau Guerrier Psi
Vous pouvez vous protéger vous-même et protéger les autres avec la force télékinétique. En tant qu'action bonus, vous pouvez choisir des créatures, dont vous pouvez faire partie, que vous pouvez voir à moins de 9 mètres de vous, jusqu'à un nombre de créatures égal à votre modificateur d'Intelligence (minimum d'une créature). Chacune des créatures choisies est protégée par une demi-couverture pendant 1 minute ou jusqu'à ce que vous soyez neutralisé. Une fois que vous avez effectué cette action bonus, vous ne pouvez plus le faire avant d'avoir terminé un repos long, à moins que vous ne dépensiez un dé d'énergie psionique pour l'effectuer à nouveau.",15.0
